{
  "$id": "EM00uWV5K7YtTt5dDWH2diXCGtDhQlrWHsLPT5WKh-Pc",
  "$schema": "https://json-schema.org/draft/2020-12/schema",
  "title": "Award Credential",
  "description": "Official praise of the issuee by the issuer. An award proves formal recognition; it does not of itself confer privileges.",
  "type": "object",
  "credentialType": "award",
  "version": "2.0.0",
  "required": [
    "v",
    "d",
    "i",
    "s",
    "a"
  ],
  "properties": {
    "v": {
      "description": "ACDC version string",
      "type": "string"
    },
    "t": {
      "description": "Message type. Optional; an ACDC JSON message without it is of type acm.",
      "type": "string"
    },
    "d": {
      "description": "SAID of this credential",
      "type": "string",
      "pattern": "^(?:[BE][A-Za-z0-9_-]{43}|0[DEFG][A-Za-z0-9_-]{86})$"
    },
    "u": {
      "description": "Salty nonce that blinds this credential's SAID",
      "type": "string"
    },
    "i": {
      "description": "AID of the issuer conferring the award",
      "type": "string",
      "pattern": "^(?:[BE][A-Za-z0-9_-]{43}|0[DEFG][A-Za-z0-9_-]{86})$"
    },
    "rd": {
      "description": "SAID of the registry whose TEL carries this credential's issuance and revocation. Optional: a casual recognition issued registry-free is coherent, and an award's own text does not promise revocability the way a licence does.",
      "type": "string",
      "pattern": "^(?:[BE][A-Za-z0-9_-]{43}|0[DEFG][A-Za-z0-9_-]{86})$"
    },
    "s": {
      "description": "SAID of this schema",
      "type": "string",
      "pattern": "^(?:[BE][A-Za-z0-9_-]{43}|0[DEFG][A-Za-z0-9_-]{86})$"
    },
    "a": {
      "oneOf": [
        {
          "description": "Attributes block SAID (compact form)",
          "type": "string",
          "pattern": "^(?:[BE][A-Za-z0-9_-]{43}|0[DEFG][A-Za-z0-9_-]{86})$"
        },
        {
          "description": "Attributes detail",
          "type": "object",
          "required": [
            "u",
            "i",
            "dt",
            "awardName"
          ],
          "properties": {
            "d": {
              "description": "SAID of this attributes block",
              "type": "string",
              "pattern": "^(?:[BE][A-Za-z0-9_-]{43}|0[DEFG][A-Za-z0-9_-]{86})$"
            },
            "u": {
              "description": "Salty nonce that blinds this block against confirmation by recomputation",
              "type": "string"
            },
            "i": {
              "description": "Issuee: the AID of the award's recipient",
              "type": "string",
              "pattern": "^(?:[BE][A-Za-z0-9_-]{43}|0[DEFG][A-Za-z0-9_-]{86})$"
            },
            "dt": {
              "description": "When the award was issued, as an ISO-8601 datetime",
              "type": "string",
              "format": "date-time",
              "examples": [
                "2026-09-15T14:23:16+00:00"
              ]
            },
            "validFrom": {
              "description": "When the award becomes public, as an ISO-8601 datetime. May be before or after issuance; absent means on issuance.",
              "type": "string",
              "format": "date-time",
              "examples": [
                "2026-09-15T14:23:16+00:00"
              ]
            },
            "validUntil": {
              "description": "When the recognition stops, as an ISO-8601 datetime. Rarely used \u2014 most awards do not expire \u2014 and absent means the issuer set no horizon, never that it is perpetual.",
              "type": "string",
              "format": "date-time",
              "examples": [
                "2027-09-15T14:23:16+00:00"
              ]
            },
            "issuerName": {
              "description": "Self-asserted name of the issuer. A convenience for human readers; carries no verification weight, and may be empty.",
              "type": "string",
              "examples": [
                "International Widget Society"
              ]
            },
            "awardName": {
              "description": "Name of the award",
              "type": "string",
              "examples": [
                "Widget of the Year"
              ]
            },
            "category": {
              "description": "A formal category for the award \u2014 a Nobel prize in the literature category, say.",
              "type": "string",
              "examples": [
                "engineering",
                "literature"
              ]
            },
            "timeframe": {
              "description": "A timeframe the award applies to \u2014 an employee-of-the-month award for July 2026, say.",
              "type": "string",
              "examples": [
                "2024",
                "July 2026"
              ]
            },
            "details": {
              "description": "The identifying layer: issuee name, citation and image. Compacts to a SAID so a holder can prove the award without disclosing them.",
              "oneOf": [
                {
                  "description": "Details block SAID (compact form)",
                  "type": "string",
                  "pattern": "^(?:[BE][A-Za-z0-9_-]{43}|0[DEFG][A-Za-z0-9_-]{86})$"
                },
                {
                  "description": "Details: the layer a holder discloses last",
                  "type": "object",
                  "required": [
                    "u"
                  ],
                  "properties": {
                    "d": {
                      "description": "SAID of this details block",
                      "type": "string",
                      "pattern": "^(?:[BE][A-Za-z0-9_-]{43}|0[DEFG][A-Za-z0-9_-]{86})$"
                    },
                    "u": {
                      "description": "Salty nonce that blinds this block. Required: without it, a verifier holding the block's SAID could confirm a guessed name or citation, which would defeat the layer this block exists to create.",
                      "type": "string"
                    },
                    "issueeName": {
                      "description": "Name of the issuee, as asserted by the issuer. A convenience for human readers; carries no verification weight, and may be empty.",
                      "type": "string",
                      "examples": [
                        "Alice Example"
                      ]
                    },
                    "citation": {
                      "description": "Formal praise designed to be displayed and quoted \u2014 'For running the 2024 Olympic Marathon in Paris in 2:01:03', or 'In recognition of many years of dedicated service'. May be empty.",
                      "type": "string"
                    },
                    "image": {
                      "description": "A data URL (RFC 2397), an ordinary URL, or the SAID/digest of an image that accompanies this award. An ordinary URL commits the issuer to a location, not to specific content \u2014 see imageByReferenceMayChange.",
                      "type": "string"
                    }
                  },
                  "additionalProperties": false
                }
              ]
            }
          },
          "additionalProperties": false
        }
      ]
    },
    "e": {
      "oneOf": [
        {
          "description": "Edges block SAID (compact form)",
          "type": "string",
          "pattern": "^(?:[BE][A-Za-z0-9_-]{43}|0[DEFG][A-Za-z0-9_-]{86})$"
        },
        {
          "description": "Edges detail",
          "type": "object",
          "minProperties": 1,
          "properties": {
            "d": {
              "description": "SAID of this edges block. Optional for the reason @enr3eg made a.d optional: the builder issuers use emits no block SAID.",
              "type": "string",
              "pattern": "^(?:[BE][A-Za-z0-9_-]{43}|0[DEFG][A-Za-z0-9_-]{86})$"
            },
            "issuer": {
              "description": "Edge to a credential that establishes who the issuer is. A vLEI credential is a good choice where one exists.",
              "type": "object",
              "required": [
                "n",
                "s",
                "o"
              ],
              "properties": {
                "n": {
                  "description": "SAID of a credential that proves the issuer's identity",
                  "type": "string",
                  "pattern": "^(?:[BE][A-Za-z0-9_-]{43}|0[DEFG][A-Za-z0-9_-]{86})$"
                },
                "s": {
                  "description": "SAID of that credential's schema",
                  "type": "string",
                  "pattern": "^(?:[BE][A-Za-z0-9_-]{43}|0[DEFG][A-Za-z0-9_-]{86})$"
                },
                "o": {
                  "description": "Operator: the issuer AID of this ACDC MUST be the issuee AID of the node this edge points to",
                  "type": "string",
                  "const": "I2I"
                }
              },
              "additionalProperties": false
            }
          },
          "additionalProperties": false
        }
      ]
    },
    "r": {
      "description": "Rules section. Optional, and open by deliberate exception: an award's terms are its issuer's to set (the Oscars and an employee recognition do not share a ruleset), so this schema does not enumerate clauses. A recommended baseline is published in rules.json; an issuer that uses it inherits the unrecognizedClauseFailsClosed obligation with it.",
      "oneOf": [
        {
          "description": "Rules section SAID (compact form)",
          "type": "string",
          "pattern": "^(?:[BE][A-Za-z0-9_-]{43}|0[DEFG][A-Za-z0-9_-]{86})$"
        },
        {
          "description": "Rules detail, whose clause vocabulary belongs to the issuer",
          "type": "object",
          "required": [
            "d"
          ],
          "properties": {
            "d": {
              "description": "SAID of this rules block",
              "type": "string",
              "pattern": "^(?:[BE][A-Za-z0-9_-]{43}|0[DEFG][A-Za-z0-9_-]{86})$"
            }
          },
          "additionalProperties": true
        }
      ]
    }
  },
  "additionalProperties": false
}
